{
  "shard": "06",
  "concepts": {
    "c_0036": {
      "revision": 2,
      "region_id": null,
      "status_fronteira": "needs_expansion",
      "definition": {
        "text": "Dolce freddo a base di latte o frutta, mantecato fino a renderlo cremoso, che si mangia d'estate.",
        "example": "Ha ordinato un gelato al pistacchio in coppetta."
      }
    }
  },
  "associations": [
    {
      "concept_a": "c_0036",
      "concept_b": "c_0382",
      "relation_type": "associata",
      "direction_hint": "symmetric",
      "association_strength": 0.65,
      "confidence": 1,
      "status": "validated",
      "revision": 1
    },
    {
      "concept_a": "c_0036",
      "concept_b": "c_0466",
      "relation_type": "associata",
      "direction_hint": "symmetric",
      "association_strength": 0.9,
      "confidence": 1,
      "status": "validated",
      "revision": 1
    },
    {
      "concept_a": "c_0036",
      "concept_b": "c_0467",
      "relation_type": "associata",
      "direction_hint": "symmetric",
      "association_strength": 0.9,
      "confidence": 1,
      "status": "validated",
      "revision": 1
    },
    {
      "concept_a": "c_0036",
      "concept_b": "c_0468",
      "relation_type": "associata",
      "direction_hint": "symmetric",
      "association_strength": 0.9,
      "confidence": 1,
      "status": "validated",
      "revision": 1
    },
    {
      "concept_a": "c_0036",
      "concept_b": "c_0469",
      "relation_type": "associata",
      "direction_hint": "symmetric",
      "association_strength": 0.65,
      "confidence": 1,
      "status": "validated",
      "revision": 1
    },
    {
      "concept_a": "c_0036",
      "concept_b": "c_0470",
      "relation_type": "associata",
      "direction_hint": "symmetric",
      "association_strength": 0.65,
      "confidence": 1,
      "status": "validated",
      "revision": 1
    },
    {
      "concept_a": "c_0036",
      "concept_b": "c_0471",
      "relation_type": "associata",
      "direction_hint": "symmetric",
      "association_strength": 0.65,
      "confidence": 1,
      "status": "validated",
      "revision": 1
    },
    {
      "concept_a": "c_0036",
      "concept_b": "c_0472",
      "relation_type": "associata",
      "direction_hint": "symmetric",
      "association_strength": 0.65,
      "confidence": 1,
      "status": "validated",
      "revision": 1
    },
    {
      "concept_a": "c_0036",
      "concept_b": "c_0473",
      "relation_type": "associata",
      "direction_hint": "symmetric",
      "association_strength": 0.65,
      "confidence": 1,
      "status": "validated",
      "revision": 1
    },
    {
      "concept_a": "c_0036",
      "concept_b": "c_0474",
      "relation_type": "associata",
      "direction_hint": "symmetric",
      "association_strength": 0.65,
      "confidence": 1,
      "status": "validated",
      "revision": 1
    },
    {
      "concept_a": "c_0036",
      "concept_b": "c_0475",
      "relation_type": "associata",
      "direction_hint": "symmetric",
      "association_strength": 0.65,
      "confidence": 1,
      "status": "validated",
      "revision": 1
    },
    {
      "concept_a": "c_0036",
      "concept_b": "c_0476",
      "relation_type": "associata",
      "direction_hint": "symmetric",
      "association_strength": 0.65,
      "confidence": 1,
      "status": "validated",
      "revision": 1
    },
    {
      "concept_a": "c_0036",
      "concept_b": "c_0477",
      "relation_type": "associata",
      "direction_hint": "symmetric",
      "association_strength": 0.65,
      "confidence": 1,
      "status": "validated",
      "revision": 1
    },
    {
      "concept_a": "c_0036",
      "concept_b": "c_0478",
      "relation_type": "associata",
      "direction_hint": "symmetric",
      "association_strength": 0.65,
      "confidence": 1,
      "status": "validated",
      "revision": 1
    },
    {
      "concept_a": "c_0036",
      "concept_b": "c_0479",
      "relation_type": "associata",
      "direction_hint": "symmetric",
      "association_strength": 0.4,
      "confidence": 1,
      "status": "validated",
      "revision": 1
    },
    {
      "concept_a": "c_0036",
      "concept_b": "c_0480",
      "relation_type": "associata",
      "direction_hint": "symmetric",
      "association_strength": 0.4,
      "confidence": 1,
      "status": "validated",
      "revision": 1
    },
    {
      "concept_a": "c_0036",
      "concept_b": "c_0466",
      "relation_type": "similarità",
      "direction_hint": "symmetric",
      "association_strength": 0.5,
      "confidence": 0.85,
      "status": "candidate",
      "revision": 1
    },
    {
      "concept_a": "c_0036",
      "concept_b": "c_0466",
      "relation_type": "oggetti",
      "direction_hint": "symmetric",
      "association_strength": 0.5,
      "confidence": 0.85,
      "status": "candidate",
      "revision": 1
    },
    {
      "concept_a": "c_0036",
      "concept_b": "c_0468",
      "relation_type": "categoria",
      "direction_hint": "symmetric",
      "association_strength": 0.8,
      "confidence": 0.85,
      "status": "candidate",
      "revision": 1
    },
    {
      "concept_a": "c_0036",
      "concept_b": "c_0469",
      "relation_type": "categoria",
      "direction_hint": "symmetric",
      "association_strength": 0.5,
      "confidence": 0.85,
      "status": "candidate",
      "revision": 1
    },
    {
      "concept_a": "c_0036",
      "concept_b": "c_0470",
      "relation_type": "similarità",
      "direction_hint": "symmetric",
      "association_strength": 0.45,
      "confidence": 0.85,
      "status": "candidate",
      "revision": 1
    },
    {
      "concept_a": "c_0036",
      "concept_b": "c_0470",
      "relation_type": "oggetti",
      "direction_hint": "symmetric",
      "association_strength": 0.45,
      "confidence": 0.85,
      "status": "candidate",
      "revision": 1
    },
    {
      "concept_a": "c_0036",
      "concept_b": "c_0472",
      "relation_type": "similarità",
      "direction_hint": "symmetric",
      "association_strength": 0.6,
      "confidence": 0.85,
      "status": "candidate",
      "revision": 1
    }
  ],
  "word_senses": {
    "s_0036": {
      "lexeme_id": "w_0036",
      "lexeme_kind": "word",
      "concept_id": "c_0036",
      "is_primary": true
    }
  },
  "words": {
    "w_0036": {
      "display_form": "gelato",
      "normalized_form": "gelato",
      "pos": null
    }
  },
  "expressions": {}
}
