{
  "shard": "1d",
  "concepts": {
    "c_0015": {
      "revision": 2,
      "region_id": null,
      "status_fronteira": "needs_expansion",
      "definition": {
        "text": "Chi ha generato o alleva un figlio, il padre o la madre.",
        "example": "Ogni genitore vuole il meglio per i propri figli."
      }
    }
  },
  "associations": [
    {
      "concept_a": "c_0015",
      "concept_b": "c_0223",
      "relation_type": "associata",
      "direction_hint": "symmetric",
      "association_strength": 0.9,
      "confidence": 1,
      "status": "validated",
      "revision": 1
    },
    {
      "concept_a": "c_0015",
      "concept_b": "c_0224",
      "relation_type": "associata",
      "direction_hint": "symmetric",
      "association_strength": 0.9,
      "confidence": 1,
      "status": "validated",
      "revision": 1
    },
    {
      "concept_a": "c_0015",
      "concept_b": "c_0225",
      "relation_type": "associata",
      "direction_hint": "symmetric",
      "association_strength": 0.9,
      "confidence": 1,
      "status": "validated",
      "revision": 1
    },
    {
      "concept_a": "c_0015",
      "concept_b": "c_0226",
      "relation_type": "associata",
      "direction_hint": "symmetric",
      "association_strength": 0.9,
      "confidence": 1,
      "status": "validated",
      "revision": 1
    },
    {
      "concept_a": "c_0015",
      "concept_b": "c_0227",
      "relation_type": "associata",
      "direction_hint": "symmetric",
      "association_strength": 0.9,
      "confidence": 1,
      "status": "validated",
      "revision": 1
    },
    {
      "concept_a": "c_0015",
      "concept_b": "c_0228",
      "relation_type": "associata",
      "direction_hint": "symmetric",
      "association_strength": 0.9,
      "confidence": 1,
      "status": "validated",
      "revision": 1
    },
    {
      "concept_a": "c_0015",
      "concept_b": "c_0229",
      "relation_type": "associata",
      "direction_hint": "symmetric",
      "association_strength": 0.65,
      "confidence": 1,
      "status": "validated",
      "revision": 1
    },
    {
      "concept_a": "c_0015",
      "concept_b": "c_0230",
      "relation_type": "associata",
      "direction_hint": "symmetric",
      "association_strength": 0.65,
      "confidence": 1,
      "status": "validated",
      "revision": 1
    },
    {
      "concept_a": "c_0015",
      "concept_b": "c_0231",
      "relation_type": "associata",
      "direction_hint": "symmetric",
      "association_strength": 0.65,
      "confidence": 1,
      "status": "validated",
      "revision": 1
    },
    {
      "concept_a": "c_0015",
      "concept_b": "c_0232",
      "relation_type": "associata",
      "direction_hint": "symmetric",
      "association_strength": 0.4,
      "confidence": 1,
      "status": "validated",
      "revision": 1
    },
    {
      "concept_a": "c_0015",
      "concept_b": "c_0233",
      "relation_type": "associata",
      "direction_hint": "symmetric",
      "association_strength": 0.4,
      "confidence": 1,
      "status": "validated",
      "revision": 1
    },
    {
      "concept_a": "c_0015",
      "concept_b": "c_0234",
      "relation_type": "associata",
      "direction_hint": "symmetric",
      "association_strength": 0.4,
      "confidence": 1,
      "status": "validated",
      "revision": 1
    },
    {
      "concept_a": "c_0015",
      "concept_b": "c_0196",
      "relation_type": "esseri_viventi",
      "direction_hint": "symmetric",
      "association_strength": 0.5,
      "confidence": 0.85,
      "status": "candidate",
      "revision": 1
    },
    {
      "concept_a": "c_0015",
      "concept_b": "c_0204",
      "relation_type": "cause",
      "direction_hint": "symmetric",
      "association_strength": 0.5,
      "confidence": 0.85,
      "status": "candidate",
      "revision": 1
    },
    {
      "concept_a": "c_0015",
      "concept_b": "c_0204",
      "relation_type": "contrasto",
      "direction_hint": "symmetric",
      "association_strength": 0.6,
      "confidence": 0.85,
      "status": "candidate",
      "revision": 1
    },
    {
      "concept_a": "c_0015",
      "concept_b": "c_0209",
      "relation_type": "esseri_viventi",
      "direction_hint": "symmetric",
      "association_strength": 0.5,
      "confidence": 0.85,
      "status": "candidate",
      "revision": 1
    },
    {
      "concept_a": "c_0015",
      "concept_b": "c_0210",
      "relation_type": "esseri_viventi",
      "direction_hint": "symmetric",
      "association_strength": 0.45,
      "confidence": 0.85,
      "status": "candidate",
      "revision": 1
    },
    {
      "concept_a": "c_0015",
      "concept_b": "c_0211",
      "relation_type": "esseri_viventi",
      "direction_hint": "symmetric",
      "association_strength": 0.45,
      "confidence": 0.85,
      "status": "candidate",
      "revision": 1
    },
    {
      "concept_a": "c_0015",
      "concept_b": "c_0212",
      "relation_type": "esseri_viventi",
      "direction_hint": "symmetric",
      "association_strength": 0.45,
      "confidence": 0.85,
      "status": "candidate",
      "revision": 1
    }
  ],
  "word_senses": {
    "s_0015": {
      "lexeme_id": "w_0015",
      "lexeme_kind": "word",
      "concept_id": "c_0015",
      "is_primary": true
    }
  },
  "words": {
    "w_0015": {
      "display_form": "genitore",
      "normalized_form": "genitore",
      "pos": null
    }
  },
  "expressions": {}
}
